digits,section,division,group,class,item,desc_en,exclude_en,include_en,desc_bm,exclude_bm,include_bm
4,C,27,279,2790,-,Manufacture of other electrical equipment,"(a) manufacture of porcelain electrical insulators see 23930 (b) manufacture of carbon and graphite fibres and products(except electrodes and electrical applications) see 23990 (c)manufacture of electronic component-type rectifiers,voltage regulating intergrated circuits,power converting intergrated circuit electronic capacitors,electronic resistors and similar devices see 26102, 26103 (d) manufacture of transformers, motors, generator, switchgear, relays and industrial controls see 2710 (e) manufacture of batteries see 27200 (f) manufacture of communication and energy wire, current carrying and non current carrying wiring devices see 27330 (g) manufacture of lighting equipment see 27400 (h) manufacture of household-type appliances see 27500 (i) manufacture of non-electrical welding and soldering equipment see 28199 (j) manuffacture of motor vehicles electrical equipment (k) manufacture of mechanocal and electromechanical signalling, safety and traffic control equipment for railways,tramways,inland waterways,roads,parking facilities,airfields see 30200",,Pembuatan kelengkapan elektrik lain,"(a) pembuatan penebat elektrik daripada porselin, lihat 23930 (b) pembuatan gentian dan produk daripada karbon dan grafit (kecuali aplikasi elektrod dan elektrik), lihat 23990 (c) pembuatan rektifier jenis komponen elektronik, litar pengatur voltan bersepadu, litar penukar kuasa bersepadu, kapasitor elektronik, perintang elektronik dan alatan seumpamanya, lihat 26102, 26103 (d) pembuatan transformer, motor, penjana, switchgear, geganti dan kawalan perindustrian, lihat 2710 (e) pembuatan bateri, lihat 27200 (f) pembuatan wayar komunikasi dan tenaga, alatan pendawaian pembawa dan bukan pembawa arus, lihat 27330 (g) pembuatan kelengkapan pencahayaan, lihat 27400 (h) pembuatan perkakasan kegunaan isi rumah, lihat 27500 (i) pembuatan kelengkapan pengimpalan dan pematerian bukan elektrik, lihat 28199 (j) pembuatan kelengkapan elektrik kenderaan bermotor (cth. penjana, alternator, palam pencucuh, pendawaian abah-abah pencucuhan, sistem tingkap dan pintu berdaya kuasa, pengatur voltan), lihat 29300 (k) pembuatan isyarat mekanikal dan elektromekanikal, kelengkapan kawalan keselamatan dan trafik untuk landasan keretapi, landasan trem, jalan air kawasan pedalaman, jalan raya, kemudahan tempat letak kenderaan, lapangan udara, lihat 30200",
4,C,28,281,2811,-,"Manufacture of engines and turbines, except aircraft, vehicle and cycle engines","(a) manufacture of electric generators(except turbine generator sets), see 27101 (b) manufacture of prime mover generator sets (except turbine generator set) see 27101 (c) manufacture of electrical equipment and components of internal combustion engines see 27900 (d) manufacture of motor vehicles propulsion engines see 2910 (e) manufacture of aircraft propulsion engines see 30300 (f) manufacture of cycle propulsion engines see 30910 (g) manufacture of turbojets and turbo propellers see 30300","(a) manufacture of marine engines (b) manufacture of railways engines (c) manufacture of pistons,piston rings,carburettors and such for all internal conbustion engines,diesel engines etc (d) manufacture of inlet and exhaust valves of internal comustion engines (e) manufacture of steam turbines and other vapour turbines (f)manufacture of hydraulic turbines,waterwheels and regulators thereof (g) manufacture of wind turbines (h) manufacture of gas turbines,except turbojets or turbo propellers for aircraft propulsion (i) manufacture of boiler-turbine sets (j) manufacture of turbine-generator sets","Pembuatan enjin dan turbin, kecuali enjin pesawat, kenderaan dan sikal","(a) pembuatan generator elektrik (kecuali set penjana turbin), lihat 27101 termasuk (b) pembuatan set penjana prime mover (kecuali set penjana turbin),lihat 27101 (c) pembuatan peralatan elektrik dan bahagian-bahagian enjin pembakaran dalaman, lihat 27900 (d) pembuatan enjin rejangan kenderaan bermotor, lihat 2910 (e) pembuatan enjin rejangan pesawat , lihat 30300 (f) pembuatan enjin rejangan sikal, lihat 30910 (g) pembuatan turbojet dan kipas turbo, lihat 30300","(a) pembuatan enjin marin (b) pembuatan enjin kereta api (c) pembuatan omboh, lingkaran omboh, karburetor dan semua enjin pembakaran dalaman, enjin diesel, dll (d) pembuatan serokan dan injap ekzos enjin pembakaran dalaman (e) pembuatan turbin stim dan turbin wap lain (f) pembuatan turbin hidraulik, waterwheels dan pengatur dan lain-lain yang berkaitan (g) pembuatan turbin angin (h) pembuatan turbin gas, kecuali turbo jet atau penggerak turbo untuk rejangan pesawat (i) pembuatan set dandang turbin (j) pembuatan set penjana turbin"
4,C,28,281,2812,-,Manufacture of fluid power equipment,(a) manufacture of compressors see 28130 (b) manufacture of pumps and valves for non-fluid power applications see 28130 (c) manufacture of mechanical transmission equipment see 28141,"(a) manufacture of hydraulic and pneumatic components (including hydraulic pumps,hydraulic motors,hydraulic and pneumatic cylinders,hydraulic and pneumatic valves,hydraulic and pneumatic hose and fittings) (b) manufacture of air preparation equipment to use in pneumatic systems (c) manufacture of fluid power systems (d) manufacture of hydraulic transmission eqipment",Pembuatan alat-alat kuasa bendalir,"(a) pembuatan pemampat, lihat 28130 (b) pembuatan pam dan injap bagi aplikasi kuasa bukan bendalir lihat 28130 (c) pembuatan peralatan transmisi mekanikal, lihat 28140","(a) pembuatan komponen-komponen hidraulik dan pneumatik (termasuk pam hidraulik, motor hidraulik, silinder hidraulik dan pneumatik, injap hidraulik dan pneumatik, hos hidraulik dan pneumatik dan kelengkapannya) (b) pembuatan peralatan air preparation untuk digunakan dalam sistem pneumatik (c) pembuatan sistem kuasa bendalir (d) pembuatan peralatan transmisi hidraulik"
4,C,28,281,2813,-,"Manufacture of other pumps, compressors, taps and valves","(a) manufacture of valves of unhardened vulcanized rubber,glass or of ceramic materials see 22191,2310 or 2393 (b) manufacture of hydraulic transmission equipment see 28120 (c) manufacture of inlet and exhaust valves of internal combustion engines, see 28110","(a) manufacture of air or vacuum pumps,air or other gas compressors (b) manufacture of pump for liquids whether or not fitted with a measuring device (c) manufacture of pumps designed for fitting to internal combustion engines (eg oil,water and fuel pumps for motor vehicles etc) (d) manufacture of industrial taps and valves,including regulating valves and intake taps (e) manufacture of sanitary taps and valves (f) manufacture of heating taps and valves (g) manufacture of hand pumps","Pembuatan pam, pemampat, kepala paip dan injap lain","(a) pembuatan injap getah tervulkan, kaca atau bahan-bahan seramik, lihat : 22191, 2310 atau 2393 ( b) pembuatan peralatan transmisi hidraulik, lihat 28120 (c) pembuatan serokan dan injap ekzos bagi enjin pembakaran dalaman, lihat 28110","(a) pembuatan pam udara atau vakum, pemampat udara atau gas lain (b) pembuatan pam untuk cecair sama ada atau tidak dipasang dengan satu alatan ukur (c) pembuatan pam yang direka bentuk untuk pemadanan enjin pembakaran dalaman (cth. pam minyak, air dan bahan api untuk kenderaan bermotor, dll.) (d) pembuatan kepala paip dan injap untuk kegunaan industri, termasuk injap pelaras dan kepala paip sedutan (e) pembuatan kepala paip dan injap sanitari (f) pembuatan kepala paip dan injap pemanasan (g) pembuatan pam tangan"
4,C,28,281,2814,-,"Manufacture of bearings, gears, gearing and driving elements",(a) manufacture of other chain see 25993 (b) manufacture of (electromagnetic)clutches see 29300V (c) manufacture of sub-assemblies of power transmission equipment identifiable as parts of vehicle or aircraft see division 29 and 30,"(a) manufacture of ball and roller bearings and parts thereof (b) manufacture of mechanical power transmission equipment (c) manufacture of gears,gearing and gear boxes and other speed changers (d) manufacture of clutches and shaft couplings (e) manufacture of flywheels and pulleys (f) manufacture of articulated link chain (g) manufacture of power transmission chain","Pembuatan penggalas, gear, elemen gear dan pemanduan","(a) pembuatan rantai yang lain, lihat 25993 (b) pembuatan klac (elektromagnetik), lihat 29300 (c) pembuatan peralatan sub-pemasangan transmisi kuasa yang dapat dikenal pasti sebagai salah satu bahagian bagi kenderaan atau pesawat, lihat bahagian 29 dan 30","(a) pembuatan penggalas bola dan penggalas penggelek dan bahagian yang berkaitan dengannya (b) pembuatan alat transmisi kuasa mekanikal (c) pembuatan gear, kotak gear dan pengubah kelajuan lain (d) pembuatan klac dan aci gandingan (e) pembuatan roda putar dan takal (f) pembuatan articulated link chain (g) pembuatan rantai transmisi kuasa"
4,C,28,281,2815,-,"Manufacture of ovens, furnaces and furnace burners","(a) manufacture of household ovens see 27500 (b) manufacture of agriculture dryers see 28250 (c) manufacture of bakery ovens see 28250 (d) manufacture of dryers for wood,paper pulp, paper or paperboard see 28290 (e) manufacture of medical, surgical or laboratory sterilizers furnaces see 32500 (f) manufacture of (dental) laboratory furnaces see 32500","(a) manufacture of electrical and other industrial and laboratory furnaces and ovens, includings incinerators (b) manufacture of burners (c) manufacture of permanent mount electric space heaters,electric swimming pool heaters (d) manufacture of permanent mount non-electric household heating equipment (e.g. solar heating, steam heating, oil heat and similar furnaces and heating equipment) (e) manufacture of electric household-type furnaces (electric forced air furnaces, heat pumps, etc.), non-electric household forced air furnaces (f) manufacture of mechanical stokers,grates, ash dischargers etc.","Pembuatan ketuhar, relau dan relau pembakar","(a) pembuatan ketuhar bagi kegunaan isi rumah, lihat 27500 (b) pembuatan mesin pengering bagi kegunaan pertanian, lihat 28250 (c) pembuatan ketuhar membakar roti, lihat 28250 (d) pembuatan mesin pengering kayu, kertas palpa, kertas atau kertas tebal, lihat 28290 (e) pembuatan alat pensteril bagi perubatan, pembedahan atau makmal, lihat 32500 (f) pembuatan ketuhar untuk kegunaan makmal (pergigian), lihat 32500","(a) pembuatan alat elektrik dan alat perindustrian lain dan relau dan ketuhar, termasuk insinerator (b) pembuatan pembakar (c) pembuatan alat pemanas elektrik terlekap, pemanas elektrik kolam renang (d) pembuatan alat pemanas bukan elektrik terlekap bagi kegunaan isi rumah (cth. pemanas solar, pemanas stim, pemanas minyak dan alat relau dan pemanas yang sama) (e) pembuatan relau jenis elektrik bagi kegunaan isi rumah (relau berasaskan elektrik , pam haba, dll.), relau bukan berasaskan elektrik bagi isi rumah (f) pembuatan mechanical stokers (perkakas untuk mengisi relau dengan bahan api), grates, alat mengeluar abu, dll."
4,C,28,281,2816,-,Manufacture of lifting and handling equipment,"(a) manufacture of continuous-action elevators and conveyor for underground use see 28240 (b) manufacture of mechanical shovels, excavators and shovel loaders see 28240 (c) manufacture of industrial robots for mutiple uses see 28290 (d) manufacture of floating cranes,railways cranes, crane-lorries see 30110,30200 (e) installation of lifts and elevators see 43291","(a) pulley tackle and hoists,winches,capstans and jacks (b) derricks,cranes,mobile lifting frames,straddle carriers etc (c) work trucks, whether or not fitted with lifting or handling equipment whether or not self-propelled, of the type used in factories (including hand trucks and wheelbarrows) (d) mechanical manipulators and industrial robots specifically designed for lifting or handling,loading or unloading (e) manufacture of conveyor,telfers etc; (f) manufacture of lifts, escalators and moving walkways (g) manufacture of parts specialized for lifting and handling equipment",Pembuatan kelengkapan mengangkat dan mengendali,"(a) pembuatan lif penyenggaraan dan alat pengangkutan bagi kegunaan kerja ; bawah tanah, lihat 28240 (b) pembuatan penyodok tanah mekanikal, mesin pengorek dan jentera penyodok, lihat 28240 (c) pembuatan robot perindustrian untuk pelbagai kegunaan, lihat 28290 (d) pembuatan kren terapung, kren landasan kereta api, kren- lori, lihat 30110, 30200 (e) pemasangan lif dan pengangkat, lihat 43291","(a) takal memungah dan mengangkat barang, win, alat penggulung tali dan mengangkat barang (b) jentera mengangkut muatan berat, kren, mesin angkat bergerak, mesin pembawa secara terbuka , dll (c) work trucks, sama ada dipasang dengan peralatan mengangkat atau pengendalian atau sebaliknya, sama ada bergerak secara sendiri atau sebaliknya, bagi kegunaan kilang (termasuk trak dan kereta sorong) (d) robot mekanikal dan perindustrian yang dirancang khusus untuk mengangkat, menggendali, memuat atau memunggah (e) pembuatan alat pengangkut (conveyors), telfers (tlphriques), dll (f) pembuatan lif, eskalator dan moving walkways (g) pembuatan peralatan khusus untuk mengangkat dan alat kelengkapan pengendalian"
4,C,28,281,2817,-,Manufacture of office machinery and equipment (except computers and peripheral equipment),manufacture of computers and peripheral equipment see 2620,"(a) manufacture of calculating machines ; (b) manufacture of adding machines, cash registers ; (c) manufacture of calculators, electronic or not ; (d) manufacture of postage meters, mail handling machines, collating machinery ; (e) manufacture of typewriters ; (f) manufacture of stenography machines ; (g) manufacture of office-type binding equipment ; (h) manufacture of cheque writing machines ; (i) manufacture of coin counting and wrapping machinery ; (j) manufacture of pencil sharpeners ; (k) manufacture of staplers and staple removers ; (l) manufacture of voting machines ; (m) manufacture of tape dispensers ; (n) manufacture of hole punches ; (o) manufacture of cash registered, mechanically operated ; (p) manufacture of photocopy machines ; (q) manufacture of toner cartridges ; (r) manufacture of blackboards; white boards and marker boards ; (s) manufacture of dictating machines ; (t) manufacture of other office machinery and equipment n.e.c.",Pembuatan mesin dan kelengkapan pejabat (kecuali kelengkapan komputer dan peranti),"pembuatan kelengkapan komputer dan peranti, lihat 2620","(a) pembuatan mesin kira-kira; (b) pembuatan mesin pengira, mesin tunai; (c) pembuatan kalkulator, sama ada elektronik ataupun tidak; (d) pembuatan meter pengiriman pos, mesin pengendalian surat, mesin menyusun; (e) pembuatan mesin taip; (f) pembuatan mesin trengkas; (g) pembuatan alat penjilidan untuk kegunaan pejabat; (h) pembuatan mesin menulis cek; (i) pembuatan mesin pengira duit syiling dan mesin pembalut; (j) pembuatan pengasah pensil; (k) pembuatan stapler dan penanggal dawai kokot; (l) pembuatan mesin undi; (m) pembuatan bekas pita; (n) pembuatan alat penebuk lubang; (o) pembuatan mesin tunai, operasi secara mekanikal; (p) pembuatan mesin fotokopi; (q) pembuatan kartrij toner; (r) pembuatan papan hitam; papan putih dan papan penanda; (s) pembuatan mesin imlak; (t) pembuatan mesin dan kelengkapan pejabat yang lain t.t.t.l."
4,C,28,281,2818,-,Manufacture of power-driven hand tools,manufacture of electrical hand-held soldering and welding equipment see 27900,"manufacture of hand tools, with self-contained electric or non-electric motor or pneumatic drives (e.g. circular or reciprocating saws, drills and hammer drills, hand held power sanders, pneumatic nailers, buffers, routers, grinders, staplers, pneumatic rivet guns, etc.)",Pembuatan alatan tangan menggunakan kuasa,"pembuatan peralatan pemateri dan kimpalan elektrik beroperasi menggunakan tangan, lihat 27900","pembuatan alatan tangan yang menggunakan kuasa dilengkapkan dengan motor elektrik atau bukan motor elektrik atau pneumatik (cth. gergaji bulat atau biasa, penebuk dan penebuk tukul, alat sanders menggunakan tangan, paku pneumatik, penampan, routers, pengisar, staplers, senapang-senapang rivet pneumatik, dll.)"
4,C,28,281,2819,-,Manufacture of other general-purpose machinery,"(a) manufacture of sensitive (laboratory-type) balances, see 26512; (b) manufacture of domestic refrigerating or freezing equipment, see 27500; (c) manufacture of domestic fans, see 27500; (d) manufacture of electrical welding and soldering equipment, see 27900; (e) manufacture of agricultural spraying machinery, see 28210; (f) manufacture of metal or glass rolling machinery and cylinders thereof, see 2823, 2829; (g) manufacture of agricultural dryers, see 2825 ; (h) manufacture of machinery for filtering or purifying food, see 2825; (i) manufacture of cream separators, see 2825; (j) manufacture of commercial clothes dryers, see 2826; (k) manufacture of textile printing machinery, see 2826",,Pembuatan jentera untuk tujuan umum lain,"(a) pembuatan bahan imbangan sensitif (jenis kegunaan makmal), lihat 26512; (b) pembuatan peralatan penyejukan dan pembekuan domestik, lihat 27500; (c) pembuatan kipas domestik, lihat 27500; (d) pembuatan peralatan kimpalan dan pemateri elektrik, lihat 27900; (e) pembuatan jentera penyemburan untuk pertanian, lihat 28210; (f) pembuatan silinder dan jentera penggelek logam atau kaca lihat 2823, 2829; (g) pembuatan mesin pengering untuk pertanian, lihat 2825; (h) pembuatan jentera untuk penapisan atau penulenan makanan, lihat 2825; (i) pembuatan alat pengasingan krim, lihat 2825; (j) pembuatan mesin pengering komersial bagi pakaian, lihat 2826 ; (k) pembuatan mesin pencetakan tekstil, lihat 2826",
4,C,28,282,2821,-,Manufacture of agricultural and forestry machinery,"(a) manufacture of non-power-driven agricultural hand tools, see 2593 (b) manufacture of conveyors for farm use, see 2816 (c) manufacture of power-driven hand tools, see 2818 (d) manufacture of cream separators, see 2825 (e) manufacture of machinery to clean, sort or grade seed, grain or dried leguminous vegetables, see 2825 (f) manufacture of road tractors for semi-trailers, see 2910 (g) manufacture of road trailers or semi-trailers, see 2920","(a) manufacture of tractors used in agriculture and forestry (b) manufacture of walking (pedestrian-controlled) tractors (c) manufacture of mowers includings lawnmowers (d) manufacture of agriculture self-loading or self-unloading trailers or semi-trailers (e) manufacture of agriculture machinery for soil preparation,planting or fertilizing (e.g. ploughs, manure spreaders, seeders, harrows, etc.) (f) manufacture of harvesting or threshing machinery (e.g. harvesters, threshers, sorters, etc.) (g) manufacture of milking machines (h) manufacture of spraying machinery for agriculture use (i)manufacture of poultry-keeping machinery, bee-keeping machinery (j) manufacture of machines for cleaning,sorting or grading eggs,fruits,etc (k) manufacture of other diverse agricultural machinery and equipment n.e.c",Pembuatan mesin bagi pertanian dan perhutanan,"(a) pengeluaran peralatan tangan pertanian yang tidak menggunakan kuasa, lihat 2593 (b) pembuatan alat pengangkut (pembawa) untuk kegunaan ladang, lihat 2816 (c) pembuatan peralatan tangan yang menggunakan kuasa, lihat 2818 (d) pembuatan alat pengasingan krim, lihat 2825 (e) pembuatan mesin untuk membersih, mengasing atau menggred biji benih, biji-bijian atau mengeringkan sayuran kekacang, lihat 2825 (f) pembuatan traktor jalan raya untuk kegunaan separa treler, lihat 2910 (g) pembuatan treler atau separa treler, lihat 2920","(a) pembuatan traktor untuk tujuan pertanian dan perhutanan (b) pembuatan traktor bergerak (yang dikawal) (c) pembuatan mesin penggerak, termasuk mesin memotong rumput (d) pembuatan trailer atau separa trailer pemuatan sendiri atau bukan pemuatan sendiri bagi tujuan pertanian (e) pembuatan mesin persediaan tanah, penanaman atau penyuburan untuk tujuan pertanian (cth. membajak, menabur baja, penyemaian biji benih, penyisir tanah, dll.) (f) pembuatan mesin menuai atau membanting (cth. mesin penuai, pembanting, pengasing dll.) (g) pembuatan mesin pemerah susu (h) pembuatan mesin pemyemburan bagi kegunaan pertanian (i) pembuatan mesin penyimpan dan menjaga binatang ternakan dan lebah (j) pembuatan mesin pembersihan, penyusunan dan penggredan telur, buah-buahan dll (k) pembuatan mesin kelengkapan lain bagi tujuan pertanian t.t.t.l."
4,C,28,282,2822,-,Manufacture of metal-forming machinery and machine tools,"(a) manufacture of interchangeable tools for hand tools or machine tools (e.g. drills, punches, dies, taps, milling cutters, turning tools, saw blades, cutting knives, etc.), see 2593 (b) manufacture of electric hand held soldering irons and soldering guns see 2790 (c) manufacture of power-driven hand tools see 2818 (d) manufacture of machinery used in metal mills or foundries see 2823 (e) manufacture of machinery for mining and quarrying see 2824","(a) manufacture of punch presses,hydraulic presses, hydraulic brakes, drop hammers, forging machines etc (b) manufacture of draw-benches,thread rollers or machines for working wires (c) manufacture of stationery rotary or rotary percussion drills,filling machines,riveters,steel metal cutters etc (d) manufacture of presses for the manufacture of particle board and the like (e) manufacture of other-metal-forming machinery n.e.c (f) manufacture of machine tools for working metals and other materials (e.g. wood, bone, stone, hard rubber, hard plastics, cold glass, etc.), including those using a laser beam, ultrasonic waves, plasma arc, magnetic pulse, etc (g) manufacture of machine tools for turning,drilling,milling,shaping,planning,boring and grinding etc (h) manufacture of stamping or pressing machine tools (i) manufacture of stationery machines for nailing,staping,glueing or otherwise assembling wood,cork,bone,hard rubber,hard plastic etc (j) manufacture of electroplating machinery (k) manufacture of parts and accessories for the machine tools listed above (e.g. work holders, dividing heads and other special attachments for machine tools) (l) manufacture of other machine tools. n.e.c",Pembuatan jentera pembentukan logam dan alatan mesin,"(a) pembuatan peralatan boleh-ubah untuk peralatan menggunakan tangan termasuk: atau mesin (cth. mesin penyemai, penebuk, acuan, pengetuk, pengisar, mata pisau, pisau pemotong, dll.), lihat 2593 (b) pembuatan alatan bagi elektrik memateri besi yang menggunakan tangan dan memateri senapang, lihat 2790 (c) pembuatan peralatan berkuasa yang menggunakan tangan, lihat 2818 (d) pengeluaran mesin bagi kegunaan kilang-kilang logam atau kaca, lihat 2823 (e) pembuatan mesin untuk perlombongan dan kuari, lihat 2824","(a) pembuatan bagi mesin penebuk tekanan, penekan hidraulik, brek hidraulik, penukul, mesin tempa, dll ( b) pembuatan draw benches, penggulung benang atau mesin untuk working wires (c) pembuatan alat putaran atau tukulan, mesin filling, riveters, alat pemotongan kepingan logam, dll (d) pembuatan mesin percetakan bagi papan tanda (e) pembuatan mesin membentuk lain-lain logam t.t.t.l. (f) pembuatan peralatan mesin untuk logam dan bahan-bahan lain (cth. kayu, tulang, batu, getah keras, plastik keras, kaca sejuk, dll.),termasuk yang menggunakan pancaran laser, ultrasonik, arka plasma, magnetik, dll (g) pembuatan peralatan mesin untuk memusing, menggerudi, mengisar, membentuk, memotong, dll (h) pembuatan peralatan mesin menekan atau pengecapan (i) pembuatan mesin alat tulis menangkap, mengokot, melekatkan atau sebaliknya bagi pemasangan kayu, penyumbat, tulang, getah keras atau plastik, dll (j) pengeluaran mesin penyaduran elektrik (k) pembuatan bahagian dan aksesori-aksesori untuk alatan mesin yang tersenarai di atas (cth. alat pemegang mesin, alat pembahagi, dan lain-lain peralatan pemasangan) (l) pembuatan lain-lain peralatan mesin lain t.t.t.l."
4,C,28,282,2823,-,Manufacture of machinery for metallurgy,"(a) manufacture of draw-benches see 2822 (b) manufacture of moulding boxes and moulds (except ingot moulds), see 2593 (c) manufacture of machines for forming foundry moulds see 2829","(a) manufactures of machines and equipment for handling hot metals: converters, ingot moulds,ladles,casting machines (b) manufacture of metal-rolling mills and roll for such mills",Pengeluaran bagi jentera untuk metalurgi,"(a) pengeluaran bangku, lihat 2822 (b) pembuatan kotak acuan dan acuan (kecuali jongkong acuan), lihat 2593 (c) pembuatan mesin untuk membentuk acuan kaca, lihat 2829","(a) pembuatan mesin dan peralatan untuk pengendalian logam panas: mesin penukaran, jongkong, cedok, mesin tuangan (b) pembuatan peralatan penggulungan logam dan alat seumpamanya"
