digits,section,division,group,class,item,desc_en,exclude_en,include_en,desc_bm,exclude_bm,include_bm
4,L,68,682,6820,-,Real estate activities on a fee or contract basis,"(a) legal activities, see 69100; (b) facilities support services, see 81100; (c) management of facilities, such as military bases, prisons and other facilities (except computer facilities management), see 81100",,Aktiviti hartanah atas dasar bayaran atau kontrak,"(a) aktiviti guaman, lihat 69100; (b) perkhidmatan kemudahan sokongan, lihat 81100; (c) pengurusan kemudahan, seperti pangkalan tentera, penjara dan kemudahan lain (kecuali pengurusan kemudahan komputer), lihat 81100",
4,M,69,691,6910,-,Legal activities,law court activities see 84235,"(a) legal representation of one partys interest against another party, whether or not before courts or other judicial bodies by, or under supervision of, persons who are members of the bar:;  advise and representation in civil cases;  advice and representation in criminal cases;  advice and representation in connection with labour disputes; (b) general counselling and advising, preparation of legal documents:;  articles of incorporation, partnership agreements or similar documents in connection with company formation;  patents and copyrights;  preparation of deeds, wills, trusts, etc.; (c) other activities of notaries public, civil law notaries, bailiffs, arbitrators, examiners and referees",Aktiviti guaman,"aktiviti mahkamah undang-undang, rujuk 84235","(a) perwakilan guaman bagi kepentingan satu pihak menentang pihak lain, sama;  ada dalam atau luar mahkamah atau badan kehakiman lain, atau di bawah pengawasan, seseorang yang menjadi ahli badan peguam:;  nasihat dan perwakilan kes jenayah;  nasihat dan perwakilan kes sivil;  nasihat dan perwakilan berhubung dengan pertelingkahan;  buruh; (b) kaunseling dan nasihat umum, penyediaan dokumen undang-undang:;  artikel perbadanan, perjanjian perkongsian atau dokumen yang; seumpamanya berhubung dengan penubuhan syarikat ;  paten dan hakcipta ;  penyediaan surat perjanjian, wasiat, amanah dll.; (c) aktiviti notari awam lain, notari undang-undang sivil, jamin, penimbangtara, pemeriksa dan pendamai"
4,M,69,692,6920,-,"Accounting, bookkeeping and auditing activities; tax consultancy","(a) data-processing and tabulation activities see 63112; (b) management consultancy such as design of accounting systems cost accounting programs, budgetary control procedures see 70209; (c) bill collection see 82910","Activities involving the recording of commercial transaction from businesses or other, the preparation or auditing of financial accounts, the examination of accounts and the certification of their accuracy and the preparation of personal and business income tax return. Included are related advisory activities and representation (other than legal representation) on behalf of clients before tax authorities","Aktiviti perakaunan, simpan kira dan audit; perundingan percukaian","(a) aktiviti pemprosesan data dan penjadualan, lihat 63112; (b) perundingan pengurusan seperti mereka bentuk sistem perakaunan, program; kos perakaunan, prosedur kawalan belanjawan, lihat 70209; (c) pungutan bil, lihat 82910","aktiviti yang melibatkan rekod transaksi komersial untuk perniagaan atau lain-lain, penyediaan atau audit akaun kewangan, pemeriksaan akaun dan pengesahan ketepatannya dan penyediaan penyata cukai pendapatan persendirian dan perniagaan. Termasuk juga aktiviti berkaitan khidmat nasihat dan perwakilan ; (selain daripada perwakilan undang-undang) bagi pihak pelanggan kepada pihak berkuasa cukai"
4,M,70,701,7010,-,Activities of head offices,"activities of holding companies,not engaged in managing see 64200","the overseeing and managing of other units of the company or enterprise:it exercise operational control and manage day-to-day operations of their related unit:its include head offices,centralized administrative offices,corporate offices,district and regional offices and subsidiary management offices",Aktiviti ibu pejabat,"aktiviti syarikat pemegang (holding companies), tidak terlibat dalam pengurusan,; lihat 64200","mengawas dan mengurus unit-unit lain di dalam syarikat atau enterpris; ia melaksana kawalan operasi dan mengurus operasi harian bagi unit yang berkaitan; ia termasuk: ibu pejabat, pejabat pusat pentadbiran, pejabat korporat, pejabat daerah dan wilayah dan pejabat pengurusan subsidiari"
4,M,70,702,7020,-,Management consultancy activities,"(a) design of computer software for accounting systems, see 62010 ; (b) legal advice and representation, see 69100; (c) accounting, bookkeeping and auditing activities, tax consulting, see 69200; (d) architectural, engineering and other technical advisory activities, see 71101, 71102, 74909; (e) advertising activities, see 73100; (f) market research and public opinion polling, see 73200; (g) executive placement or search consulting services, see 78100; (h) educational consulting activities, see 85500",,Aktiviti perundingan pengurusan,"(a) mereka bentuk perisian komputer untuk sistem perakaunan, lihat 62010; (b) perwakilan dan nasihat perundangan, lihat 69100; (c) aktiviti perakaunan, simpan kira dan audit, perundingan percukaian, lihat; 69200; (d) aktiviti arkitek, kejuruteraan dan khidmat nasihat teknikal lain, lihat 71101,; 71102, 74909; (e) aktiviti pengiklanan, lihat 73100; (f) penyelidikan pemasaran dan tinjauan pendapat umum, lihat 73200; (g) khidmat perundingan pencarian dan penempatan eksekutif, lihat 78100; (h) aktiviti perundingan pendidikan, lihat 85500",
4,M,71,711,7110,-,Architectural and engineering activities and related technical consultancy,"(a) test drilling in connection with mining operations, see 09101, 09900; (b) development or publishing of associated software, see 58201, 62010; (c) activities of computer consultants, see 62021, 6209; (d) technical testing, see 71200; (e) research and development activities related to engineering, see 72102; (f) industrial design, see 74109; (g) interior decorating, see 74101; (h) aerial photography, see 74200",,Aktiviti arkitek dan kejuruteraan dan perundingan teknikal yang berkaitan,"(a) ujian penggerudian berkaitan dengan operasi perlombongan, lihat 09101,; 09900 ; (b) pembangunan atau penerbitan perisian berkaitan, lihat 58201, 62010; (c) aktiviti perundingan komputer, lihat 62021, 6209; (d) ujian teknikal, lihat 71200; (e) aktiviti penyelidikan dan pembangunan berkaitan kejuruteraan, lihat 72102; (f) reka bentuk perindustrian, lihat 74109; (g) hiasan dalaman, lihat 74101; (h) fotografi dari udara, lihat 74200",
4,M,71,712,7120,-,Technical testing and analysis,,,Ujian teknikal dan analisis,,
4,M,72,721,7210,-,Research and experimental development on natural sciences and engineering,,,Penyelidikan dan pembangunan eksperimen sains semula jadi dan kejuruteraan,,
4,M,72,722,7220,-,Research and experimental development on social sciences and humanities,"market research, see 73200",,Penyelidikan dan pembangunan eksperimen sains sosial dan kemanusiaan,"Penyelidikan pasaran, lihat 7320",
4,M,73,731,7310,-,Advertising,,,Pengiklanan,,
4,M,73,732,7320,-,Market research and public opinion polling,,,Penyelidikan pasaran dan tinjauan pendapat umum,,
4,M,74,741,7410,-,Specialized design activities,"(a) design and programming of web pages, see 62010; (b) architectural design, see 71101; (c) engineering design, i.e. applying physical laws and principles of engineering in the design of machines, materials, instruments, structures, processes and systems, see 71102",,Aktiviti mereka bentuk khusus,"(a) reka bentuk dan pengaturcaraan laman web, lihat 62010; (b) reka bentuk arkitek, lihat 71101; (c) reka bentuk kejuruteraan, contoh penggunaan hukum fizikal dan prinsip kejuruteraan dalam mereka bentuk jentera, bahan, peralatan, struktur, proses dan sistem, lihat 71102",
4,M,74,742,7420,-,Photographic activities,(a) processing motion picture film related to the motion picture and television industries see 59120; (b) cartographic and spatial information activities see 71109,,Aktiviti fotografi,"(a) prosesan filem wayang gambar yang berkaitan dengan industri perfileman dan; televisyen, lihat 59120; (b) aktiviti kartografi dan informasi ruang, lihat 7110",
4,M,74,749,7490,-,"Other professional, scientific and technical activities n.e.c.","(a) wholesale of used motor vehicles by auctioning, see 45102, 45104; (b) online auction activities (retail), see 47914; (c) activities of auctioning houses (retail), see 47999; (d) activities of real estate brokers, see 68201; (e) bookkeeping activities, see 69200; (f) activities of management consultants, see 70201; (g) activities of architecture see 71101 and engineering consultants, see 71102; (h) engineering design activities, see 71102; (i) land surveying services, see 71103; (j) display of advertisement and other advertising design, see 73100; (k) creation of stands and other display structures and sites, see 73100; (l) industrial design activities, see 7410; (m) activities of convention and trade show organizers, see 82301; (n) activities of independent auctioneers, see 82990; (o) administration of loyalty programmers, see 82990; (p) consumer credit and debt counselling, see 88901; (q) activities of authors of scientific and technical books, see 90004; (r) activities of independent journalists, see 90005",,"Aktiviti profesional, saintifik dan teknikal lain t.t.t.l","(a) jualan borong kenderaan bermotor secara lelongan, lihat 45102, 45104; (b) aktiviti lelongan secara on-line (jualan runcit), lihat 47914; (c) aktiviti lelongan rumah (jualan runcit), lihat 47999; (d) aktiviti broker hartanah, lihat 68201; (e) aktiviti simpan kira, lihat 69200; (f) aktiviti perunding pengurusan, lihat 70201; (g) aktiviti arkitek, seperti dalam perkara 71101 dan perunding kejuruteraan, lihat 71102; (h) aktiviti rekabentuk kejuruteraan, lihat 71102; (i) aktiviti juru ukur tanah, lihat 71103; (j) paparan iklan dan lain-lain rekabentuk pengiklanan, lihat 73100; (k) membina struktur tempat letak dan pameran lain dan tapak, lihat 73100; (l) aktiviti rekabentuk industri, lihat 7410; (m) aktiviti berbentuk konvensyen dan penganjur pameran perdagangan, lihat 82301; (n) aktiviti jurulelong persendirian, lihat 82990; (o) pentadbiran kesetiaan program,lihat 82990; (p) kaunseling kredit dan hutang consumer, lihat 88901; (q) aktiviti penulisan buku-buku saintifik dan teknikal, lihat 90004; (r) aktiviti wartawan persendirian, lihat 90005",
4,M,75,750,7500,-,Veterinary activities,"(a) farm animal boarding activities without health care, see 01620; (b) sheep shearing see 01620; (c) herd testing services, droving services , agistment service, poultry caponizing see 01620; (d) activities related to artificial insemination see 01620; (e) pet animal boarding activities without health care see 96094","(a) animal health care and control activities for farm animals; (b) animal health care and control activities for pet animals. These activities are carried out by qualified veterinarians when working in veterinary hospitals as well as when visiting farms, kennels or homes, in own consulting and surgery rooms or elsewhere; (c) activities of veterinary assistants or other auxiliary veterinary personnel; (d) clinico-pathological and other diagnostic activities pertaining to animals ; (e) animal ambulance activities; (f) testing of animal specimens",Aktiviti veterinar,"(a) aktiviti penginapan haiwan ternakan tanpa penjagaan kesihatan, lihat 01620; (b) mengetam bulu biri-biri, lihat 01620; (c) perkhidmatan ujian kepada kumpulan haiwan, pengangkutan haiwan,; penyediaan kawasan ragut, pemandulan unggas, lihat 01620 ; (d) aktiviti berkaitan permanian beradas, lihat 01620 ; (e) aktiviti penginapan haiwan peliharaan tanpa penjagaan kesihatan, lihat 96094","(a) aktiviti pengawalan dan penjagaan kesihatan haiwan untuk haiwan ternakan; (b) aktiviti pengawalan dan penjagaan kesihatan haiwan untuk haiwan peliharaan. Aktiviti-aktiviti ini di bawah penyeliaan doktor veterinar yang berkelayakan di hospital veterinar dan juga apabila melawat ladang, rumah anjing atau rumah, di bilik pembedahan dan perundingan persendirian atau di tempat lain; (c) aktiviti pembantu veterinar atau aktiviti veterinartambahan lain; (d) clinicopathological dan aktiviti diagnostik lain berkaitan denganhaiwan; (e) aktiviti ambulan haiwan; (f) ujian spesimen haiwan"
4,N,77,771,7710,-,Renting and leasing of motor vehicles,"(a) renting or leasing of vehicles (see 49225) or trucks (see 49230) with driver; (b) financial leasing, see 64910",,Penyewaan dan pemajakan kenderaan bermotor,"(a) Penyewaan dan pemajakan dengan pemandu untuk kenderaan (lihat 49225) atau trak (lihat 49230); (b) pemajakan kewangan, lihat 64910",
4,N,77,772,7721,-,Renting and leasing of recreational and sports goods,"(a) renting of video tapes and disks, see 77220; (b) rental of other personal and household goods n.e.c., see 77299; (c) renting of leisure and pleasure equipment as an integral part of recreational facilities, see 93293",,Penyewaan dan pemajakan barang rekreasi dan sukan,"(a) penyewaan pita video dan cakera, lihat 77220; (b) sewaan barangan persendirian dan isi rumah lain t.t.t.l., lihat perkara 77299; (c) penyewaan kelengkapan liburan sebagai sebahagian daripada kemudahan rekreasi, lihat 93293",
4,N,77,772,7722,-,Renting of video tapes and disks,,,Penyewaan pita video dan cakera,,
4,N,77,772,7729,-,Renting and leasing of other personal and household goods,"(a) renting of cars, trucks, trailers and recreational vehicles without driver, see 77101; (b) renting of recreational and sports goods, see 7721; (c) rental of video tapes and disks, see 77220; (d) renting of motorcycles and caravans without driver, see 77302; (e) renting of office furniture, see 77307; (f) provision of linen, work uniforms and related items by laundries, see 96013",,Penyewaan dan pemajakan barang persendirian dan isi rumah lain,"(a) penyewaan kereta, trak, treler dan kenderaan rekreasi tanpa pemandu, lihat (77101); (b) penyewaan barang rekreasi dan sukan, lihat 7721; (c) sewaan pita video dan cakera, lihat 77220; (d) penyewaan motosikal dan karavan tanpa pemandu, lihat 77302; (e) penyewaan perabot pejabat, lihat 77307; (f) penyediaan cadar, pakaian seragam untuk bekerja dan perkara-perkara berkaitan oleh kedai dobi, lihat 96013",
4,N,77,773,7730,-,"Renting and leasing of other machinery, equipment and tangible goods","(a) renting of agricultural (see 01610) and forestry (see 02401) machinery or equipment with operator; (b) renting of construction and civil engineering machinery or equipment with operator, see division 43; (c) renting of water-transport equipment with operator, see division 50; (d) renting of air-transport equipment with operator, see division 51; (e) financial leasing, see 64910; (f) renting of pleasure boats, see 77211 ; (g) renting of bicycles, see 77212",,"Penyewaan dan pajakan mesin, kelengkapan dan barang ketara lain","(a) penyewaan mesin dan kelengkapan pertanian (lihat 01610) dan perhutanan; (lihat 02401) dengan operator; (b) penyewaan kelengkapan dan mesin pembinaan dan kejuruteraan awam dengan operator, lihat bahagian 43; (c) penyewaan kelengkapan pengangkutan air dengan operator, lihat bahagian 50; (d) penyewaan kelengkapan pengangkutan udara dengan operator, lihat bahagian 51; (e) pemajakan kewangan, lihat 64910; (f) penyewaan bot peranginan, lihat 77211; (g) penyewaan basikal, lihat 77212",
4,N,77,774,7740,-,"Leasing of intellectual property and similar products, except copyrighted works","(a) acquisition of rights and publishing see division 58,59; (b) producing ,reproducing and distribution copyrighted works (e.g. books, software, film), see divisoin 58,59; (c) leasing of real estate see group 681; (d) leasing of tangible products (assets) see group 771,772,773; (e) renting of video tapes and disks see 77220; (f) renting of books see 77294",,"Pemajakan harta intelektual dan produk seumpamanya, kecuali kerja berhakcipta","(a) pemerolehan hak milik dan penerbitan, lihat bahagian 58, 59; (b) mengeluar, mengeluar semula dan mengedar kerja berhakcipta (seperti buku, perisian, filem), lihat bahagian 58,59 ; (c) pemajakan hartanah, lihat kumpulan 681 ; (d) pemajakan produk ketara (aset), lihat kumpulan 771, 772, 773 ; (e) penyewaan pita video dan cakera, lihat 77220; (f) penyewaan buku, lihat 77294",
4,N,78,781,7810,-,Activities of employment placement agencies,activities of personal theatrical or artistic agents or agencies see 74909,,Aktiviti agensi penempatan pekerjaan,"aktiviti teater persendirian atau agen atau agensi artistik, lihat 74909",
4,N,78,782,7820,-,Temporary employment agency activities,,,Aktiviti agensi pekerjaan sementara,,
4,N,78,783,7830,-,Other human resources provision,"(a) provision of human resources functions together with supervision or running of the business,see the class in the respective economic activity of that business; (b) provision of human resources to temporarily replace or supplement the workforce of the client see 78200",,Penyediaan sumber manusia lain,"(a) menyedia sumber manusia berserta  penyeliaan atau  menjalankan; (perniagaan, lihat kelas dalam aktiviti ekonomi berkaitan; (b) menyedia sumber manusia bagi mengganti atau menambah tenaga kerja secara sementara kepada pelanggan, lihat 78200",
4,N,79,791,7911,-,Travel agency activities,,,Aktiviti agensi pengembaraan,,
4,N,79,791,7912,-,Tour operator activities,,,Aktiviti operator pelancongan,,
4,N,79,799,7990,-,Other reservation service and related activities,"(a) activities of travel agencies see 79110 and tour operators see 79120; (b) organization and management of events such as meetings, conventions and conferences see 8230",,Khidmat penempahan dan aktiviti berkaitan,"(a) aktiviti agensi pengembaraan lihat 79110 dan operator pelancongan, lihat; 79120; (b) mengelola dan mengurus acara seperti mesyuarat, konvensyen dan persidangan, lihat 8230",
4,N,80,801,8010,-,Private security activities,public order and safety activities see 8423,,Aktiviti keselamatan persendirian,"aktiviti keselamatan dan ketenteraman awam, lihat 8423",
4,N,80,802,8020,-,Security systems service activities,"(a) installation of security system, see 43216; (b) selling security system, mechanical or electronic locking devices, safes and security vaults, without monitoring, installation or maintenance services, see 47597; (c) security consultants, see 74903; (d) public order and safety activities, see 8423; (e) providing key duplication services, see 95299",,Aktiviti perkhidmatan sistem keselamatan,"(a) pemasangan sistem keselamatan, lihat 43216; (b) penjualan sistem keselamatan, alat kunci mekanikal atau elektronik, peti simpanan dan peti keselamatan, tanpa pengawasan, pemasangan dan penyelenggaraan, lihat 47597; (c) perunding keselamatan, lihat 74903; (d) aktiviti keselamatan dan ketenteraman awam, lihat 8423; (e) perkhidmatan penyediaan kunci pendua, lihat 95299",
4,N,80,803,8030,-,Investigation activities,,,Aktiviti penyiasatan,,
4,N,81,811,8110,-,Combined facilities support activities,"(a) provision of only one of the support services (e.g.general interior cleaning services) or addressing only a single function see( e.g. heating) see the appropiate class according to the service provided; (b) provision of management and operating staff for the complete operation of a clients establishment(e.g. a hotel, restaurant,mine or hospital) see the class of the unit operated; (c) provision of on site management and operation of a clients computer system and/or data processing facilities see 6202; (d) operation of correctional facilities an a contract or fee basis, see 84239",,Aktiviti sokongan gabungan pelbagai kemudahan,"(a) peruntukan kepada hanya satu perkhidmatan sokongan (cth. perkhidmatan; pembersihan dalaman am) atau penyediaan fungsi tunggal (cth: pemanasan), lihat kelas yang bersesuaian dengan perkhidmatan yang disediakan; (b) penyediaan pekerja operasi dan pengurusan untuk melaksanakan sepenuhnya operasi sesebuah pertubuhan pelanggan (cth: hotel, restoran, lombong atau hospital), lihat pengkelasan unit operasi; (c) penyediaan pengurusan dan operasi di tapak untuk kemudahan system komputer dan/atau pemprosesan data pelanggan, lihat 6202; (d) operasi baik pulih kemudahan berdasarkan kontrak atau yuran, lihat 84239",
4,N,81,812,8121,-,General cleaning of buildings,"specialized interior cleaning activities (e.g chimney cleaning, cleaning of fireplaces, stoves, furnaces, incinerator, boilers, ventilation ducts, exhaust units) see 8129",,Pembersihan am bangunan,"perkhidmatan pembersihan dalaman yang khusus (cth: pembersihan serombong; dan pembersihan tempat perdiangan, relau, pembakar, dandang, saluran pengaliran udara dan unit ekzos), lihat 8129",
4,N,81,812,8129,-,Other building and industrial cleaning activities,"(a) agriculture pest control, see 01610; (b) cleaning of sewers and drains, see 37000; (c) automobile cleaning, car wash, see 45203",,Aktiviti pembersihan bangunan dan perindustrian lain,"(a) kawalan haiwan perosak pertanian, lihat 01610; (b) pembersihan pembentungan dan longkang, lihat 37000; (c) pembersihan kenderaan, membasuh kereta, lihat 45203",
4,N,81,813,8130,-,Landscape care and maintenance service activities,"(a) commercial production and planting for commercial production of plants, trees see division 01,02; (b) tree nurseries(except forest tree nurseries), see 01304; (c) maintenance of land to keep it in good condition for argiculture use see 01610; (d) construction activities for landscaping purposes see section F ; (e) lanscape design and architecture activities see 7110; (f) operation of botanial gardens see 91031",,Aktiviti perkhidmatan penjagaan dan penyelenggaraan landskap,"(a) pengeluaran komersil dan penanaman untuk pengeluaran tanaman dan pokok; secara komersil, lihat bahagian 01, 02; (b) tapak semaian (kecuali tapak semaian pokok hutan), lihat 01304; (c) penyelenggaraan tanah agar berkeadaan baik untuk tujuan pertanian, lihat 01610; (d) aktiviti pembinaan untuk tujuan landskap, lihat seksyen F; (e) aktiviti merekabentuk dan arkitek landskap, lihat 7110; (f) operasi taman botani, lihat 91031",
4,N,82,821,8211,-,Combined office administrative service activities,"(a) provision of operating staff to carry out the complete operations of a business, see class according to the business/activity performed   (b) provision of only one particular aspect of these activities, see class according to that particular activity",,Gabungan aktiviti perkhidmatan pengurusan pejabat,"(a) penyediaan pekerja operasi untuk melaksanakan sepenuhnya operasi; sesebuah perniagaan, lihat kelas bagi perniagaan/aktiviti yang dijalankan; (b) penyediaan hanya untuk menjalankan satu aktiviti khusus sahaja, lihat kelas bagi aktiviti khusus berkenaan",
4,N,82,821,8219,-,"Photocopying, document preparation and other specialized office support activities","(a) printing of documents (offset printing, quick printing, etc.), see 18110 ; (b) direct mail advertising, see 73100; (c) specialized steno type services such as court reporting, see 82990; (d) public stenography services, see 82990",,"Aktiviti fotokopi, penyediaan dokumen dan lain-lain aktiviti sokongan pejabat khusus","(a) pencetakan dokumen (percetakan ofset, cepat, dll.), lihat 18110; (b) pengiklanan secara mel, lihat 73100; (c) perkhidmatan jurutrengkas khusus seperti laporan mahkamah, lihat 82990; (d) perkhidmatan trengkas awam, lihat 82990",
4,N,82,822,8220,-,Activities of call centres,,,Aktiviti pusat panggilan,,
4,N,82,823,8230,-,Organization of conventions and trade shows,,,Pengurusan konvensyen dan pameran perdagangan,,
4,N,82,829,8291,-,Activities of collection agencies and credit bureaus,,,Aktiviti agensi kutipan dan biro kredit,,
4,N,82,829,8292,-,Packaging activities,(a) manufacture of soft drinks and production of mineral water see 1104; (b) packaging activities incidental to transport see 52299,"packaging of meat, pharmaceuticals",Aktiviti pembungkusan,"(a) pembuatan minuman ringan dan pengeluaran air mineral, lihat 1104; (b) aktiviti pembungkusan sampingan untuk pengangkutan, lihat 52299",pembungkusan daging dan farmaseutikal
4,N,82,829,8299,-,Other business support service activities n.e.c.,(a) provision of document transcription services see 82194; (b) providing film or tape captioning or subtitling services see 59120,"(a) providing verbatim reporting and stenotype recording of live legal proceedings & real time closed captioning of live television performance of meetings conferences; (b) address bar coding services and bar code imprinting services; (c) fundraising organization services on a contract or fee basis; (d) direct mailing activities (addressing, pre-sorting, etc.); (e) repossession services; (f) parking meter coin collection services; (g) activities of independent auctioneers; (h) administrative of loyalty programmes; (i) runner-providing services or running errands for a business such as sending letters/bills/payments, etc",Aktiviti perkhidmatan sokongan perniagaan t.t.t.l,"(a) menyediakan perkhidmatan transkripsi dokumen, lihat 82194; (b) menyediakan perkhidmatan rakaman filem atau pita atau sari kata, lihat 59120","(a) penyediaan laporan setiap patah perkataan dan secara trengkas untuk prosiding perundangan secara langsung dan siaran mesyuarat dan persidangan secara langsung melalui televisyen; (b) perkhidmatan pengekodan bar dan pencetakan kod bar; (c) perkhidmatan organisasi pengumpulan dana berdasarkan kontrak atau yuran; (d) penyisihan mel; (e) perkhidmatan pemilikan semula ; (f) perkhidmatan kutipan syiling di parkir bermeter; (g) akitiviti pelelong bebas; (h) pengurusan program loyalti; (i) runner  menyediakan perkhidmatan atau menjalankan kerja yang diarah untuk perniagaan seperti menghantar surat/bil/bayaran, dll."
