digits,section,division,group,class,item,desc_en,exclude_en,include_en,desc_bm,exclude_bm,include_bm
5,C,26,265,2652,26520,Manufacture of watches and clocks and parts,"manufacture of non-metal watch bands (textile, leather, plastic), see 1512. manufacture of watch bands of precious metal, see 3211.manufacture of watch bands of non-precious metal, see 3212","manufacture of watches and clocks of all kinds, including instrument panel clocks",Pembuatan jam tangan dan jam dan bahagiannya,,
5,C,26,266,2660,26600,"Manufacture of irradiation, electro medical and electrotherapeutic equipment","manufacture of laboratory analytical instruments (e.g. blood analysis equipment), see 26512. manufacture of tanning beds, see 27900",manufacture of irradiation apparatus and tubes,"Pembuatan peralatan penyinaran, perubatan elektro dan elektroterapeutik",,
5,C,26,267,2670,26701,Manufacture of optical instruments and equipment,,manufacture of optical machinists precision tools,Pembuatan instrumen dan kelengkapan optikal,,
5,C,26,267,2670,26702,Manufacture of photographic equipment,,manufacture of film cameras and digital cameras,Pembuatan peralatan fotografi,,
5,C,26,268,2680,26800,Manufacture of magnetic and optical recording media,"reproduction of recorded media: computer media, sound, video, etc., see 1820",manufacture of blank magnetic audio and video tapes and cassettes,Pembuatan media rakaman magnetik dan optikal,,
5,C,27,271,2710,27101,"Manufacture of electric motors, generators and transformers",,"manufacture of distribution transformers, electric","Pembuatan motor elektrik, penjana dan transformer",,
5,C,27,271,2710,27102,Manufacture of electricity distribution and control apparatus,,manufacture of transmission and distribution voltage regulators,Pembuatan perkakasan pengagihan dan pengawalan elektrik,,
5,C,27,272,2720,27200,Manufacture of batteries and accumulators,,manufacture of non-rechargeable and rechargeable batteries,Pembuatan bateri dan akumulator,,
5,C,27,273,2731,27310,Manufacture of fibre optic cables,"manufacture of glass fibres or strand, see 23109. manufacture of optical cable sets or assemblies, see depending on application, e.g. 26102",manufacture of fibre optic cables for data transmission or live transmission of images,Pembuatan kabel gentian optikal,,
5,C,27,273,2732,27320,Manufacture of other electronic and electric wires and cables,"manufacture (drawing) of wire, see 24102, 24104, 24109, 24209. manufacture of computer cables, printer cables, USB cables and similar cable sets or assemblies, see 26109. manufacture of cable sets, wiring harnesses and similar cable sets or assemblies for automotive applications, see 29300","manufacture of insulated wire and cable, made of steel, copper, and aluminium",Pembuatan wayar dan kabel elektronik dan elektrik lain,,
5,C,27,273,2733,27330,Manufacture of current-carrying and non current-carrying wiring devices for electrical circuits regardless of material,"manufacture of ceramic insulators, see 23930. manufacture of sockets, and switches, see 26109","manufacture of bus bars, electrical conductors (except switchgear-type)",Pembuatan alatan pendawaian pembawa dan bukan pembawa arus untuk litar elektrik (tanpa mengira jenis bahan),,
5,C,27,274,2740,27400,Manufacture of electric lighting equipment,"manufacture of glassware and glass parts for lighting fixtures, see 23109. manufacture of current-carrying wiring devices for lighting fixtures, see 27330. manufacture of ceiling fans or bath fans with integrated lighting fixtures, see 27500. manufacture of electrical signalling equipment such as traffic lights and pedestrian signalling equipment, see 27900",manufacture of electric light bulbs and tubes and parts and components,Pembuatan kelengkapan pencahayaan elektrik,,
5,C,27,275,2750,27500,Manufacture of domestic appliances,"manufacture of commercial and industrial refrigerators and freezers, room air-conditioners, attic fans, permanent mount space heaters and commercial ventilation and exhaust fans, commercial-type cooking equipment; commercial-type laundry, dry-cleaning, and pressing equipment; commercial, industrial and institutional vacuum cleaners, see division 28. manufacture of household-type sewing machines, see 28260. installation of central vacuum cleaning systems, see 43294","manufacture of refrigerators, freezers",Pembuatan perkakasan domestik,,
5,C,27,279,2790,27900,"Manufacture of miscellaneous electrical equipment other than motors, generators and transformers, batteries and accumulators, wires and wiring devices, lighting equipment or domestic appliances","manufacture of porcelain electrical insulators, see 23930. manufacture of carbon and graphite fibres and products (except electrodes and electrical applications), see 23990. manufacture of electronic component-type rectifiers, voltage regulating integrated circuits, power converting integrated circuits, electronic capacitors, electronic resistors and similar devices, see 26102, 26103. manufacture of transformers, motors, generators, switchgear, relays and industrial controls, see 2710. manufacture of batteries, see 27200. manufacture of communication and energy wire, current-carrying and non current-carrying wiring devices, see 27330. manufacture of lighting equipment, see 27400. manufacture of household-type appliances, see 27500. manufacture of non-electrical welding and soldering equipment, see 28199. manufacture of motor vehicle electrical equipment (e.g. generators, alternators, spark plugs, ignition wiring harnesses, power window and door systems, voltage regulators), see 29300. manufacture of mechanical and electromechanical signalling, safety and traffic control equipment for railways, tramways, inland waterways, roads, parking facilities, airfields, see 30200","manufacture of battery charges, solid-state","Pembuatan pelbagai kelengkapan elektrik selain daripada motor, penjana dan transformer, bateri dan akumulator, wayar dan alatan pendawaian, kelengkapan pencahayaan atau perkakasan domestik",,
5,C,28,281,2811,28110,"Manufacture of engines and turbines, except aircraft, vehicle and cycle engines","manufacture of electric generators (except turbine generator sets), see 27101. manufacture of prime mover generator sets (except turbine generator sets), see 27101. manufacture of electrical equipment and components of internal combustion engines, see 27900. manufacture of motor vehicle propulsion engines, see 2910 . manufacture of aircraft propulsion engines, see 30300. manufacture of cycle propulsion engines, see 30910. manufacture of turbojets and turbo propellers, see 30300",manufacture of marine engines,"Pembuatan enjin dan turbin, kecuali enjin pesawat, kenderaan dan sikal",,
5,C,28,281,2812,28120,Manufacture of fluid power equipment,"manufacture of compressors, see 28130. manufacture of pumps and valves for non-fluid power applications, see 28130. manufacture of mechanical transmission equipment, see 28140","manufacture of hydraulic and pneumatic components (including hydraulic pumps, hydraulic motors, hydraulic and pneumatic cylinders, hydraulic and pneumatic valves, hydraulic and pneumatic hose and fittings)",Pembuatan alat-alat kuasa bendalir,,
5,C,28,281,2813,28130,"Manufacture of other pumps, compressors, taps and valves","manufacture of valves of unhardened vulcanized rubber, glass or of ceramic materials, see 22191, 2310 or 2393. manufacture of hydraulic transmission equipment, see 28120. manufacture of inlet and exhaust valves of internal combustion engines, see 28110","manufacture of air or vacuum pumps, air or other gas compressors","Pembuatan pam, pemampat, kepala paip dan injap lain",,
5,C,28,281,2814,28140,"Manufacture of bearings, gears, gearing and driving elements","manufacture of other chain, see 25993. manufacture of (electromagnetic) clutches, see 29300. manufacture of sub-assemblies of power transmission equipment identifiable as parts of vehicles or aircraft, see divisions 29 and 30",manufacture of ball and roller bearings and parts thereof,"Pembuatan penggalas, gear, elemen gear dan pemanduan",,
5,C,28,281,2815,28150,"Manufacture of ovens, furnaces and furnace burners","manufacture of household ovens, see 27500. manufacture of agricultural dryers, see 28250. manufacture of bakery ovens, see 28250. manufacture of dryers for wood, paper pulp, paper or paperboard, see 28290. manufacture of medical, surgical or laboratory sterilizers, see 32500. manufacture of (dental) laboratory furnaces, see 32500","manufacture of electrical and other industrial and laboratory furnaces and ovens, including incinerators","Pembuatan ketuhar, relau dan relau pembakar",,
5,C,28,281,2816,28160,Manufacture of lifting and handling equipment,"manufacture of continuous-action elevators and conveyors for underground use, see 28240. manufacture of mechanical shovels, excavators and shovel loaders, see 28240. manufacture of industrial robots for multiple uses, see 28290. manufacture of floating cranes, railway cranes, crane-lorries, see 30110, 30200. installation of lifts and elevators, see 43291","pulley tackle and hoists, winches, capstans and jacks",Pembuatan kelengkapan mengangkat dan mengendali,,
5,C,28,281,2817,28170,Manufacture of office machinery and equipment (except computers and peripheral equipment),"manufacture of computers and peripheral equipment, see 2620",manufacture of calculating machines,Pembuatan mesin dan kelengkapan pejabat (kecuali kelengkapan komputer dan peranti),,
5,C,28,281,2818,28180,Manufacture of power-driven hand tools with self-contained electric or non-electric motor or pneumatic drives,"manufacture of electrical hand-held soldering and welding equipment, see 27900","manufacture of hand tools, with self-contained electric or non-electric motor or pneumatic drives (e.g. circular or reciprocating saws, drills and hammer drills, hand held power sanders, pneumatic nailers, buffers, routers, grinders, staplers, pneumatic rivet guns, etc.)",Pembuatan alatan tangan yang menggunakan kuasa dilengkapkan dengan motor elektrik atau bukan motor elektrik atau pneumatik,,
5,C,28,281,2819,28191,Manufacture of refrigerating or freezing industrial equipment,,manufacture of non-domestic fans,Pembuatan kelengkapan penyejukan atau pembekuan perindustrian,,
5,C,28,281,2819,28192,"Manufacture of air-conditioning machines, including for motor vehicles",,,"Pembuatan mesin penyaman udara, termasuk untuk kenderaan bermotor",,
5,C,28,281,2819,28199,Manufacture of other general-purpose machinery n.e.c.,,"manufacture of weighing machinery, household and shop scales, etc.",Pengeluaran mesin tujuan umum lain t.t.t.l,,
5,C,28,282,2821,28210,Manufacture of agricultural and forestry machinery,"manufacture of non-power-driven agricultural hand tools, see 2593. manufacture of conveyors for farm use, see 2816. manufacture of power-driven hand tools, see 2818. manufacture of cream separators, see 2825. manufacture of machinery to clean, sort or grade seed, grain or dried leguminous vegetables, see 2825. manufacture of road tractors for semi-trailers, see 2910. manufacture of road trailers or semi-trailers, see 2920",manufacture of tractors used in agriculture and forestry,Pembuatan mesin bagi pertanian dan perhutanan,,
5,C,28,282,2822,28220,Manufacture of metal-forming machinery and machine tools,"manufacture of interchangeable tools for hand tools or machine tools (e.g. drills, punches, dies, taps, milling cutters, turning tools, saw blades, cutting knives, etc.), see 2593. manufacture of electric hand held soldering irons and soldering guns, see 2790. manufacture of power-driven hand tools, see 2818. manufacture of machinery used in metal mills or foundries, see 2823. manufacture of machinery for mining and quarrying, see 2824","manufacture of punch presses, hydraulic presses, hydraulic brakes, drop hammers, forging machines, etc.",Pembuatan jentera pembentukan logam dan alatan mesin,,
5,C,28,282,2823,28230,Manufacture of machinery for metallurgy,"manufacture of draw-benches, see 2822. manufacture of moulding boxes and moulds (except ingot moulds), see 2593. manufacture of machines for forming foundry moulds, see 2829","manufactures of machines and equipment for handling hot metals: converters, ingot moulds, ladles, casting machines",Pengeluaran bagi jentera untuk metalurgi,,
5,C,28,282,2824,28240,"Manufacture of machinery for mining, quarrying and construction","manufacture of lifting and handling equipment, see 2816. manufacture of other tractors, see 2821, 2910. manufacture of machine tools for working stone, including machines for splitting or clearing stone, see 2822. manufacture of concrete-mixer lorries, see 2910. manufacture of mining locomotives and mining rail cars, see 3020",manufacture of continuous-action elevators and conveyors for underground use,"Pembuatan mesin untuk perlombongan, pengkuarian dan pembinaan",,
5,C,28,282,2825,28250,"Manufacture of machinery for food, beverage and tobacco processing","manufacture of food and milk irradiation equipment, see 2660. manufacture of packing, wrapping and weighing machinery, see 2819. manufacture of cleaning, sorting or grading machinery for eggs, fruit or other crops (except seeds, grains and dried leguminous vegetables), see 2821",manufacture of agricultural dryers,"Pembuatan mesin untuk makanan, minuman dan pemprosesan tembakau",,
5,C,28,282,2826,28260,"Manufacture of machinery for textile, apparel and leather production","manufacture of paper or paperboard cards for use on jacquard machines, see 1709. manufacture of domestic washing and drying machines, see 2750. manufacture of calendaring machines, see 2819. manufacture of machines used in bookbinding, see 2829","machines for preparing, producing, extruding, drawing, texturing or cutting man-made textile fibres, materials or yarns","Pembuatan mesin untuk tekstil, pakaian dan pengeluaran kulit",,
5,C,28,282,2829,28290,Manufacture of other special-purpose machinery n.e.c.,"manufacture of household appliances, see 2750. manufacture of photocopy machines, see 2817. manufacture of machinery or equipment to work hard rubber, hard plastics or cold glass, see 2822. manufacture of ingot moulds, see 2823",manufacture of machinery for making paper pulp,Pembuatan lain-lain mesin bertujuan khas t.t.t.l.,,
5,C,29,291,2910,29101,Manufacture of passenger cars,,manufacture of passenger cars,Pembuatan kereta penumpang,,
5,C,29,291,2910,29102,Manufacture of commercial vehicles,,manufacture of vans,Pembuatan kenderaan komersial,,
5,C,29,292,2920,29200,Manufacture of bodies (coachwork) for motor vehicles; manufacture of trailers and semi-trailers,"manufacture of trailers and semi-trailers specially designed for use in agriculture, see 2821. manufacture of parts and accessories of bodies for motor vehicles, see 29300. manufacture of vehicles drawn by animals, see 3099",manufacture of cabs for motor vehicles,Pembuatan kerangka (coachwork) untuk kenderaan bermotor; pembuatan treler dan semi treler,,
5,C,29,293,2930,29300,Manufacture of parts and accessories for motor vehicles,"manufacture of tyres, see 2211. manufacture of rubber hoses and belts and other rubber products, see 22191. manufacture of plastic hoses and belts and other plastic products, see 22202 . manufacture of batteries for vehicles, see 27200. manufacture of lighting equipment for motor vehicles, see 2740. manufacture of pistons, piston rings and carburettors, see 2811. manufacture of pumps for motor vehicles and engines, see 2813. manufacture of motor vehicle engines, see 2910. manufacture of chassis fitted with engines, see 2910. manufacture of bodies for motor vehicles, see 29200. maintenance, repair and alternation of motor vehicles, see 4520","manufacture of brakes, gearboxes, axles, road wheels, suspension shock absorbers, radiators, silencers, exhaust pipes, catalytic converters, clutches, steering wheels, steering columns and steering boxes",Pembuatan alat ganti dan aksesori untuk kenderaan bermotor,,
5,C,30,301,3011,30110,Building of ships and floating structures,"manufacture of parts of vessels, other than major hull assemblies: manufacture of sails, see 13922; manufacture of ships propellers, see 25999; manufacture of iron or steel anchors, see 25999; manufacture of marine engines, see 2811. manufacture of navigational instruments, see 26511. manufacture of lighting equipment for ships, see 2740. manufacture of amphibious motor vehicles, see 29102. manufacture of inflatable boats or rafts for recreation, see 3012. specialized repair and maintenance of ships and floating structures, see 3315. ship-breaking, see 38301. interior installation of boats, see 43306",building of commercial and passenger vessels,Pembinaan kapal dan struktur terapung,,
5,C,30,301,3012,30120,Building of pleasure and sporting boats,"manufacture of parts of pleasure and sporting boats: manufacture of sails, see 13922; manufacture of iron or steel anchors, see 2599; manufacture of marine engines, see 2811. manufacture of sailboards and surfboards, see 3230. maintenance, repair or alteration of pleasure boats, see 3315",manufacture of inflatable boats and rafts,Pembinaan bot persiaran dan sukan,,
5,C,30,302,3020,30200,Manufacture of railway locomotives and rolling stock,"manufacture of unassembled rails, see 24109. manufacture of assembled railway track fixtures, see 25999. manufacture of electric motors, see 27101. manufacture of electrical signalling, safety or traffic-control equipment, see 27900. manufacture of engines and turbines, see 28110","manufacture of electric, diesel, steam and other rail locomotives",Pembuatan keretapi lokomotif dan rolling stock,,
5,C,30,303,3030,30300,Manufacture of air and spacecraft and related machinery,"manufacture of parachutes, see 13922. manufacture of military ordinance and ammunition, see 2520. manufacture of telecommunication equipment for satellites, see 2630. manufacture of aircraft instrumentation and aeronautical instruments, see 26511. manufacture of air navigation system, see 2651. manufacture of lighting equipment for aircraft, see 2740. manufacture of ignition parts and other electrical parts for internal combustion engines, see 27900. manufacture of pistons, piston rings and carburettors, see 2811. manufacture of aircraft launching gear, aircraft carrier catapults and related equipment, see 2829","manufacture of airplanes for transport of goods or passengers, for use by the defence forces, for sport or other purposes",Pembuatan pesawat dan kapal angkasa dan jentera berkaitan,,
5,C,30,304,3040,30400,Manufacture of military fighting vehicles,"manufacture of weapons and ammunitions, see 2520",manufacture of tanks,Pembuatan kenderaan tempur ketenteraan,,
5,C,30,309,3091,30910,Manufacture of motorcycles,"manufacture of bicycles, see 30920. manufacture of invalid carriages, see 30920","manufacture of motorcycles, mopeds and cycle fitted with an auxiliary engine",Pembuatan motosikal,,
5,C,30,309,3092,30920,Manufacture of bicycles and invalid carriages,"manufacture of bicycles with auxiliary motor, see 3091. manufacture of wheeled toys designed to be ridden, including plastic bicycles and tricycles, see 3240","manufacture of non-motorized bicycles and other cycles, including (delivery) tricycles, tandems, childrens bicycles and tricycles",Pembuatan basikal dan invalid carriages,,
5,C,30,309,3099,30990,Manufacture of other transport equipments n.e.c..,"works trucks, whether or not fitted with lifting or handling equipment, whether or not self-propelled, of the type used in factories (including hand trucks and wheelbarrows), see 2816. decorative restaurant carts, such as desert cart, food wagons, see 3100","manufacture of hand-propelled vehicles (luggage trucks, handcarts, sledges, shopping carts, etc.)",Pembuatan kelengkapan pengangkutan lain t.t.t.l.,,
5,C,31,310,3100,31001,Manufacture of wooden and cane furniture,,,Pembuatan perabot kayu dan rotan,,
5,C,31,310,3100,31002,Manufacture of metal furniture,,,Pembuatan perabot logam,,
5,C,31,310,3100,31003,Manufacture of mattress,,manufacture of mattresses fitted with springs or stuffed or internally fitted with a supporting material,Pembuatan tilam,,
5,C,31,310,3100,31009,"Manufacture of other furniture, except of stone, concrete or ceramic",,,"Pembuatan perabot lain kecuali daripada batu, konkrit atau seramik",,
5,C,32,321,3211,32110,Manufacture of jewellery and related articles,"manufacture of non-metal watch bands (fabric, leather, plastic, etc.), see 1512. manufacture of articles of base metal plated with precious metal (except imitation jewellery), see division 25. manufacture of watch cases, see 2652. manufacture of (non-precious) metal watch bands, see 3212. manufacture of imitation jewellery, see 3212",production of worked pearls,Pembuatan barang kemas dan artikel berkaitan,,
5,C,32,321,3212,32120,Manufacture of imitation jewellery and related articles,"manufacture of jewellery made from precious metals or clad with precious metals, see 3211. manufacture of jewellery containing genuine gem stones, see 3211. manufacture of precious metal bands, see 3211","manufacture of customer or imitation jewellery (e.g. rings, bracelets, necklace, and similar articles of jewellery made from base metals plated with precious metals or imitation stones)",Pembuatan barang kemas tiruan dan artikel berkaitan,,
5,C,32,322,3220,32200,Manufacture of musical instruments,"reproduction of pre-recorded sound and video tapes and discs, see 1820. manufacture of microphones, amplifiers, loudspeakers, hand phones and similar components, see 2640. manufacture of record players, tape recorders and the like, see 2640. manufacture of toy musical instruments, see 3240. restoring of organs and other historic musical instruments, see 3319. publishing of pre-recorded sound and video tapes and discs, see 5920. piano tuning, see 95296",manufactured or stringed instruments,Pembuatan instrumen muzik,,
5,C,32,323,3230,32300,Manufacture of sports goods,"manufacture of boat sails, see 13922. manufacture of sports apparel, see 14101. manufacture of saddlery and harness, see 15120. manufacture of whips and riding crops, see 15120. manufacture of sports footwear, see 1520. manufacture of sporting weapons and ammunition, see 25200. manufacture of metal weights as used for weightlifting, see 25999. manufacture of automatic bowling alley equipment (e.g. pin-setters) see 28290. manufacture of sports vehicles other than toboggans and the like, see divisions 29 and 30. manufacture of boats, see 30120. manufacture of billiard tables, see 32400. manufacture of ear and noise plugs (e.g. for swimming and noise protection), see 32909","manufacture of articles and equipment for sports, outdoor and indoor games, of any material (e.g. hard, soft and inflatable balls; rackets, bats and clubs; sailboards and surfboards; requisites for sport fishing, including landing nets; requisites for hunting, mountain climbing, etc.; leather sports gloves and sports headgear, roller skates; bow and crossbows; gymnasium fitness centre or athletic equipment, ski-boots, etc.)",Pembuatan barangan sukan,,
5,C,32,324,3240,32400,Manufacture of games and toys,"manufacture of video game consoles, see 26400. manufacture of bicycles, see 30920. writing and publishing of software for video game consoles, see 58202, 62010","manufacture of dolls, toys (ceramic, glass, paper, paperboard, wooden, rubber, etc.) and games such as complete dolls, doll parts, doll clothes, action toys, games (including electronic, paper or paperboard), hobby kits, and childrens vehicles (except metal bicycles and tricycles)",Pembuatan permainan dan mainan,,
5,C,32,325,3250,32500,Manufacture of medical and dental instrument and supplies,"manufacture of denture adhesives, see 20232. manufacture of medical impregnated wadding, dressings, etc., see 21009. manufacture of electro medical and electrotherapeutic equipment, see 26600. manufacture of wheelchairs, see 30920",manufacture of laboratory apparatus,Pembuatan peralatan dan bekalan perubatan dan pergigian,,
5,C,32,329,3290,32901,Manufacture of stationery,,manufacture of pens and pencils of all kinds whether or not mechanical,Pembuatan alat tulis,,
5,C,32,329,3290,32909,Other manufacturing n.e.c.,,manufacture of pens and pencils of all kinds whether or not mechanical,Pembuatan lain t.t.t.l,,
5,C,33,331,3311,33110,Repair of fabricated metal products,"repair of central heating systems, etc., see 43221. repair of mechanical locking devices, safes, etc., see 80200","repair of metal tanks, reservoirs and containers",Pembaikan produk logam yang direka,,
5,C,33,331,3312,33120,Repair and maintenance of industrial machinery and equipment,"installation, repair and maintenance of furnaces and other heating equipment, see 4322. installation, repair and maintenance of elevators and escalators, see 43291",repair and maintenance of non-automotive engines,Pembaikan dan penyelenggaraan jentera dan kelengkapan industri,,
5,C,33,331,3313,33131,"Repair and maintenance of the measuring, testing, navigating and control equipment",,repair and maintenance of aircraft engine instruments,"Pembaikan dan penyelenggaraan peralatan menyukat, menguji, memandu arah dan kelengkapan kawalan",,
5,C,33,331,3313,33132,"Repair and maintenance of irradiation, electro medical and electrotherapeutic equipment",,repair and maintenance of magnetic resonance imaging equipment,"Pembaikan dan penyelenggaraan penyinaran, perubatan elektro dan kelengkapan electrotherapeutic",,
5,C,33,331,3313,33133,Repair of optical instruments and photographic equipment,,"repair of binoculars, microscopes (except electron, proton), telescopes, prisms and lenses (except ophthalmic)",Pembaikan bagi peralatan optikalal dan alatan fotografi,,
